{
  "$schema": "https://json-schema.org/draft/2020-12/schema",
  "title": "Curriculum Version",
  "type": "object",
  "required": [
    "id",
    "agency",
    "name",
    "status",
    "education_levels",
    "effective_from"
  ],
  "properties": {
    "id": {
      "type": "string",
      "pattern": "^[A-Z0-9]+(?:-[A-Z0-9]+)*$"
    },
    "agency": {
      "type": "string"
    },
    "name": {
      "type": "string"
    },
    "status": {
      "type": "string"
    },
    "education_levels": {
      "type": "array",
      "minItems": 1,
      "uniqueItems": true,
      "items": {
        "type": "string",
        "minLength": 1
      }
    },
    "effective_from": {
      "type": "string"
    },
    "effective_until": {
      "type": [
        "string",
        "null"
      ]
    },
    "grade_rollout": {
      "type": "object"
    },
    "legal_bases": {
      "type": "array",
      "items": {
        "type": "string"
      }
    },
    "notes": {
      "type": [
        "string",
        "null"
      ]
    }
  },
  "additionalProperties": false
}
